{
  "$schema": "http://json-schema.org/draft-07/schema#",
  "definitions": {
    "CostGroup": {
      "description": "One grouped row in [`CostOutput::groups`], emitted when `rocky cost` is run with `--by <dimension>`.\n\nEach group sums the per-model figures of the executions that share the grouping key (a tenant, or a model name). The cost roll-up uses the same `compute_observed_cost_usd` figures as [`PerModelCostHistorical`], so a `--by tenant` total equals the sum of its members' `cost_usd`.",
      "properties": {
        "dimension": {
          "description": "Dimension the grouping was performed on: `\"tenant\"` or `\"model\"`.",
          "type": "string"
        },
        "key": {
          "description": "The grouping key's value — the tenant name, the model name, or the literal `\"<unattributed>\"` for the `--by tenant` bucket that collects executions with no recorded tenant.",
          "type": "string"
        },
        "model_count": {
          "description": "Number of model executions rolled into this group.",
          "format": "uint64",
          "minimum": 0.0,
          "type": "integer"
        },
        "total_bytes_scanned": {
          "description": "Sum of the group's member `bytes_scanned`. `None` when no member reported bytes scanned.",
          "format": "uint64",
          "minimum": 0.0,
          "type": [
            "integer",
            "null"
          ]
        },
        "total_bytes_written": {
          "description": "Sum of the group's member `bytes_written`. `None` when no member reported bytes written.",
          "format": "uint64",
          "minimum": 0.0,
          "type": [
            "integer",
            "null"
          ]
        },
        "total_cost_usd": {
          "description": "Sum of every member's `cost_usd` that produced a number. `None` when no member produced a cost.",
          "format": "double",
          "type": [
            "number",
            "null"
          ]
        },
        "total_duration_ms": {
          "description": "Wall-clock time summed across the group's member executions.",
          "format": "uint64",
          "minimum": 0.0,
          "type": "integer"
        }
      },
      "required": [
        "dimension",
        "key",
        "model_count",
        "total_duration_ms"
      ],
      "type": "object"
    },
    "PerModelCostHistorical": {
      "description": "A single model's cost attribution inside [`CostOutput`].\n\nDistinct from [`ModelCostEntry`] (which lives on [`RunCostSummary`]) because the historical surface carries the richer fields the state store actually persists: model name (not asset-key vector), row/byte counts, and the recorded per-model status.",
      "properties": {
        "bytes_scanned": {
          "description": "Adapter-reported bytes figure used for cost accounting. This is the *billing-relevant* number per adapter, not literal scan volume:\n\n- **BigQuery:** `totalBytesBilled` — includes the 10 MB per-query minimum floor; matches the BigQuery console's \"Bytes billed\" field, **not** \"Bytes processed\". - **Databricks:** when populated, byte count from the statement-execution manifest (`total_byte_count`); `None` today until the manifest plumbing lands. - **Snowflake:** `None` — deferred by design (QUERY_HISTORY round-trip cost; Snowflake cost is duration × DBU, not bytes-driven). - **DuckDB:** `None` — no billed-bytes concept.",
          "format": "uint64",
          "minimum": 0.0,
          "type": [
            "integer",
            "null"
          ]
        },
        "bytes_written": {
          "description": "Adapter-reported bytes-written figure. Currently `None` on every adapter — BigQuery doesn't expose a bytes-written figure for query jobs, and the Databricks / Snowflake paths haven't wired it yet.",
          "format": "uint64",
          "minimum": 0.0,
          "type": [
            "integer",
            "null"
          ]
        },
        "cost_usd": {
          "description": "Observed cost for this execution. `None` when the adapter isn't a billed warehouse, the config couldn't be loaded, or the formula inputs were unavailable (e.g. BigQuery without `bytes_scanned`).",
          "format": "double",
          "type": [
            "number",
            "null"
          ]
        },
        "duration_ms": {
          "format": "uint64",
          "minimum": 0.0,
          "type": "integer"
        },
        "model_name": {
          "type": "string"
        },
        "rows_affected": {
          "format": "uint64",
          "minimum": 0.0,
          "type": [
            "integer",
            "null"
          ]
        },
        "status": {
          "type": "string"
        },
        "stored_bytes": {
          "description": "The bytes the model's output table stored right after this execution wrote it, read back from the persisted `rocky_core::state::ModelExecution::stored_bytes`. Read `stored_bytes_basis` to tell an exact figure from an estimate.\n\n`None` (and omitted from JSON) means unknown: a view, a replicated table, a `time_interval` partition, an adapter that cannot measure it (every adapter except DuckDB today), an in-memory DuckDB database, a failed measurement, or a run recorded before this field existed. There is no run total: the bases differ, so a sum would mix exact and estimated figures.",
          "format": "uint64",
          "minimum": 0.0,
          "type": [
            "integer",
            "null"
          ]
        },
        "stored_bytes_basis": {
          "anyOf": [
            {
              "$ref": "#/definitions/StoredBytesBasis"
            },
            {
              "type": "null"
            }
          ],
          "description": "How `stored_bytes` was measured: `data_files` (exact Parquet data-file bytes, content-addressed outputs) or `allocated_blocks` (an estimate: DuckDB storage blocks times the block size, which overstates a small table). Present exactly when `stored_bytes` is."
        },
        "tenant": {
          "description": "Tenant this execution was attributed to, read back from the persisted `rocky_core::state::ModelExecution::tenant`. Present only for replication executions whose source schema declared a `{tenant}` component; `None` (and omitted from JSON) otherwise.",
          "type": [
            "string",
            "null"
          ]
        },
        "upstream_reads": {
          "anyOf": [
            {
              "$ref": "#/definitions/UpstreamReads"
            },
            {
              "type": "null"
            }
          ],
          "description": "What the execution read from each upstream table, read back from the persisted `rocky_core::state::ModelExecution::upstream_reads`. It is a measurement, not a cost: `est_bytes` is an estimate from fixed-width column types, and nothing here splits an upstream's cost.\n\nOmitted when not measured: a non-DuckDB adapter, a shadow, branch or backfill run, a failed profile read, or a run recorded before this field existed."
        }
      },
      "required": [
        "duration_ms",
        "model_name",
        "status"
      ],
      "type": "object"
    },
    "RunScopeKind": {
      "description": "Where a recorded run wrote its results, as `rocky history` and `rocky cost` report it (#2201).",
      "oneOf": [
        {
          "description": "Wrote production targets.",
          "enum": [
            "production"
          ],
          "type": "string"
        },
        {
          "description": "`rocky run --shadow` / `--shadow-schema`: wrote shadow targets.",
          "enum": [
            "shadow"
          ],
          "type": "string"
        },
        {
          "description": "`rocky run --branch <name>`: wrote a named Rocky branch.",
          "enum": [
            "branch"
          ],
          "type": "string"
        },
        {
          "description": "Recorded before runs carried a scope (#2200). Where it wrote is unknown. Also what a reader of an older payload without the field sees.",
          "enum": [
            "unrecorded"
          ],
          "type": "string"
        }
      ]
    },
    "StoredBytesBasis": {
      "description": "How a [`StoredBytes`] figure was measured.",
      "oneOf": [
        {
          "description": "Exact: the summed size of the table's live Parquet data files, as Rocky wrote them. Excludes table-format metadata (the Delta log, Iceberg manifests).",
          "enum": [
            "data_files"
          ],
          "type": "string"
        },
        {
          "description": "Estimate: the number of storage blocks the table's column segments occupy, times the block size (DuckDB). It is file space allocated to the table, not payload bytes. It overstates a small table (a partly filled block counts in full), counts a block shared with another table once for each table, and leaves out table metadata blocks.",
          "enum": [
            "allocated_blocks"
          ],
          "type": "string"
        }
      ]
    },
    "UpstreamRead": {
      "description": "What one model execution read from one upstream table.\n\nA measurement of the scan, not a price: a later step may use it to split the upstream's cost across its consumers.",
      "properties": {
        "est_bytes": {
          "description": "Estimate: `rows_scanned` times the summed fixed width of the projected columns, per scan. `None` when a projected column is variable-width (text, blob, list, struct), a column type could not be read, or no columns were named. It is in-memory width, not bytes on disk.",
          "format": "uint64",
          "minimum": 0.0,
          "type": [
            "integer",
            "null"
          ]
        },
        "projected_columns": {
          "default": [],
          "description": "The columns the scans read, first seen first, with no repeats. Empty when the profile did not name them.",
          "items": {
            "type": "string"
          },
          "type": "array"
        },
        "rows_scanned": {
          "description": "Rows the scan operators of this execution read from the table, summed over every scan of it (a self-join counts both). Not rows returned.",
          "format": "uint64",
          "minimum": 0.0,
          "type": "integer"
        },
        "table": {
          "description": "The upstream table as `catalog.schema.table`, in the names the warehouse reports. On DuckDB the catalog is the database name (`memory` for an in-memory database).",
          "type": "string"
        }
      },
      "required": [
        "rows_scanned",
        "table"
      ],
      "type": "object"
    },
    "UpstreamReads": {
      "description": "The upstream reads of one model execution.",
      "properties": {
        "reads": {
          "default": [],
          "description": "One entry per upstream table, sorted by `table`. The model's own target is left out.",
          "items": {
            "$ref": "#/definitions/UpstreamRead"
          },
          "type": "array"
        },
        "unattributed_scans": {
          "default": 0,
          "description": "Scans that name no table: a file (Parquet, CSV, Iceberg) or a table function such as `range`. They are counted, not attributed.",
          "format": "uint64",
          "minimum": 0.0,
          "type": "integer"
        }
      },
      "type": "object"
    }
  },
  "description": "JSON output for `rocky cost <run_id|latest>`.\n\nHistorical per-run cost attribution read from the embedded state store's [`rocky_core::state::RunRecord`]. Re-derives per-model cost via [`rocky_core::cost::compute_observed_cost_usd`] — the same formula [`RunOutput::populate_cost_summary`] applies at the end of a live run. The per-model and per-run totals make the \"what did my last run cost?\" question answerable from the recorded run alone, without re-materialising tables.\n\n# Adapter type resolution\n\nThe `RunRecord` only carries `config_hash`, not the adapter type. The command loads `rocky.toml` to resolve the billed-warehouse type. When the config can't be loaded (working-dir mismatch, missing file, parse error), the output degrades gracefully: `adapter_type` stays `None` and `cost_usd` is `None` on every model, but durations and byte counts are still populated from the stored record.\n\n# BigQuery note\n\nBecause [`rocky_core::state::ModelExecution::bytes_scanned`] is persisted, this command can return a real cost figure for BigQuery runs even though the live `rocky run` path currently reports `cost_usd: None` for BQ (adapter bytes-scanned plumbing is a follow-up).",
  "properties": {
    "adapter_type": {
      "description": "Adapter type the cost formula was parameterised against, for audit. Mirrors `AdapterConfig.type`. `None` when the config couldn't be loaded or the adapter isn't a billed warehouse.",
      "type": [
        "string",
        "null"
      ]
    },
    "command": {
      "type": "string"
    },
    "duration_ms": {
      "format": "uint64",
      "minimum": 0.0,
      "type": "integer"
    },
    "finished_at": {
      "type": "string"
    },
    "groups": {
      "description": "Grouped cost rollup, present only when `--by <dimension>` is passed. `--by model` produces one group per model; `--by tenant` produces one group per tenant (models with no recorded tenant land in an `\"<unattributed>\"` bucket). `None` (and omitted from JSON) for a plain `rocky cost` invocation, so the default output shape is unchanged. `per_model` is always present regardless of grouping.",
      "items": {
        "$ref": "#/definitions/CostGroup"
      },
      "type": [
        "array",
        "null"
      ]
    },
    "per_model": {
      "items": {
        "$ref": "#/definitions/PerModelCostHistorical"
      },
      "type": "array"
    },
    "run_id": {
      "type": "string"
    },
    "run_scope": {
      "allOf": [
        {
          "$ref": "#/definitions/RunScopeKind"
        }
      ],
      "default": "unrecorded",
      "description": "Where the reported run wrote (#2201). `rocky cost latest` reports the newest production run: shadow and branch runs are skipped, and a run recorded before runs carried a scope is eligible and reads `unrecorded` here. An explicit run id reports that run, whatever its scope."
    },
    "started_at": {
      "type": "string"
    },
    "status": {
      "type": "string"
    },
    "total_bytes_scanned": {
      "description": "Sum of per-model `bytes_scanned`. `None` when no model reported bytes scanned.",
      "format": "uint64",
      "minimum": 0.0,
      "type": [
        "integer",
        "null"
      ]
    },
    "total_bytes_written": {
      "description": "Sum of per-model `bytes_written`. `None` when no model reported bytes written.",
      "format": "uint64",
      "minimum": 0.0,
      "type": [
        "integer",
        "null"
      ]
    },
    "total_cost_usd": {
      "description": "Sum of every per-model `cost_usd` that produced a number. `None` when no model produced a cost.",
      "format": "double",
      "type": [
        "number",
        "null"
      ]
    },
    "total_duration_ms": {
      "description": "Wall-clock time summed across every model execution.",
      "format": "uint64",
      "minimum": 0.0,
      "type": "integer"
    },
    "trigger": {
      "type": "string"
    },
    "version": {
      "type": "string"
    }
  },
  "required": [
    "command",
    "duration_ms",
    "finished_at",
    "per_model",
    "run_id",
    "started_at",
    "status",
    "total_duration_ms",
    "trigger",
    "version"
  ],
  "title": "CostOutput",
  "type": "object"
}
